"乗り換え";"norikae";"transfer (kereta api, bus, dll.); mengubah; koneksi, beralih (ke ideologi lain, partai, sistem, metode, dll.); mengubah; konversi, peralihan (stok), persilangan kromosom; menyebrang"
"乗り込む";"norikomu";"untuk naik; untuk memulai; untuk masuk ke (mobil); kepada manusia (sebuah kapal); untuk membantu (seseorang) masuk, untuk berbaris; memasuki"
"刃";"ha ; yaiba";"ujung (dari pisau atau pedang), cabang (dari colokan listrik) ; Pedang, pisau palsu; pola bergelombang pada bilah tempa, ketajaman, gabah"
"派";"ha";"klik; kelompok, (politik) faksi; sayap; berpesta; kamp, sekolah, sekte; denominasi"
"把握";"haaku";"mencengkeram; menangkap; memahami"
"灰";"hai";"abu"
"肺";"hai";"paru-paru"
"廃棄";"haiki";"pembuangan; pengabaian; membuang; penghapusan, pembatalan; pencabutan; mencabut"
"配給";"haikyuu";"distribusi (misalnya film, beras), jatah (misalnya makanan, bensin), ransum makanan"
"配偶者";"haiguusha";"pasangan; istri; suami; mitra"
"拝啓";"haikei";"Yang terhormat (fulan); Yang terhormat; Nyonya yg terhormat; Untuk Perhatian"
"背景";"haikei";"latar belakang; pemandangan; setting, latar belakang (kejadian, situasi, dan lain-lain); keadaan; konteks, dukungan; dukungan (dari belakang layar)"
"背後";"haigo";"kembali; belakang, latar belakang; di balik layar"
"灰皿";"haizara";"asbak"
"廃止";"haishi";"penghapusan; mencabut"
"拝借";"haishaku";"peminjaman"
"排除";"haijo";"pengecualian; pemindahan; penolakan; eliminasi; pengurangan; pencabutan (sanksi, dll.)"
"排水";"haisui";"drainase; menguras; memompa keluar (air); saluran pembuangan, perpindahan"
"敗戦";"haisen";"mengalahkan; kalah dalam pertempuran; kalah perang"
"配置";"haichi";"pengaturan (sumber daya); penyebaran; penempatan; posting; watak; konfigurasi; tata letak"
"配布";"haifu";"distribusi"
"配分";"haibun";"distribusi; peruntukan"
"配慮";"hairyo";"pertimbangan; kekhawatiran; Perhatian; membuat pengaturan; peduli; masalah"
"配列";"hairetsu";"pengaturan; disposisi, array (pemrograman)"
"映える";"haeru";"bersinar, agar terlihat menarik; agar terlihat bagus; untuk berangkat (oleh)"
"破壊";"hakai";"penghancuran; gangguan, (aplikasi) mogok"
"はかどる";"hakadoru";"untuk membuat kemajuan (baik); untuk bergerak maju (dengan pekerjaan); untuk memajukan"
"果ない";"hakanai";"sekilas; sementara; berumur pendek; sejenak; tdk kekal; berubah-ubah; sia-sia, kosong (mimpi, dll.); belaka (harapan); pingsan (kemungkinan)"
"諮る";"hakaru";"untuk berkonsultasi dengan; mendiskusikan; untuk berunding"
"図る";"hakaru";"untuk merencanakan; untuk mencoba; untuk merancang, merencanakan; untuk berkonspirasi; untuk membuat skema, yang ingin dituju; untuk diperjuangkan; untuk bekerja menuju; untuk berusaha, menipu; untuk mengelabui; untuk menerima"
"はがす";"hagasu";"untuk merobek; untuk mengelupas; untuk menanggalkan; ke kulit; untuk menguliti; untuk menanggalkan jubah; untuk menghilangkan; untuk melepaskan; untuk memutuskan sambungan"
"破棄";"haki";"merobek dan membuang (misalnya dokumen); pembuangan (misalnya persenjataan); pemusnahan, pembatalan; pencabutan; berkemih; pelanggaran (misalnya perjanjian), pembalikan (dari keputusan awal)"
"泊";"haku";"konter untuk malam menginap, menginap; penginapan"
"吐く";"haku ; tsuku";"memuntahkan; untuk muntah; meludah, memancarkan; untuk mengirimkan; menghembuskan nafas, memberikan (pendapat); untuk membuat (komentar); untuk mengekspresikan; untuk memberitahu, untuk mengaku ; menghembuskan nafas, mengatakan (berbohong); menggunakan (bahasa kotor), untuk muntah; untuk meludah"
"迫害";"hakugai";"penganiayaan; penindasan"
"薄弱";"hakujaku";"kelemahan"
"はくじょう";"hakujou";"pengakuan ; tongkat putih (untuk orang buta atau tunanetra) ; tidak berperasaan; kejam; Berhati dingin"
"はぐ";"hagu";"untuk merobek; untuk mengelupas; untuk menanggalkan; ke kulit; untuk menguliti; menggonggong, melucuti (pakaian, pangkat, dll.); untuk menghilangkan; untuk melakukan divestasi ; untuk menyerang ; untuk bergabung (kain, kayu, dll.) ; untuk mengupas, menguliti; untuk mengeksploitasi"
"接ぐ";"hagu ; tsugu";"untuk bergabung (kain, kayu, dll.) ; bergabung; untuk menyatukan; untuk mengatur (tulang), untuk mencangkok (ke pohon)"
"派遣";"haken";"menugaskan; pengiriman; penempatan, pegawai sementara (khususnya dari agensi); pekerja sementara; suhu agensi"
"励ます";"hagemasu";"untuk mendorong; menyemangati; untuk meninggikan (suara)"
"励む";"hagemu";"untuk berusaha; menjadi bersemangat"
"はげる";"hageru";"kehilangan rambut; menjadi botak, menjadi gundul (misalnya gunung menjadi gundul) ; untuk lepas; menjadi luntur, memudar; untuk mengubah warna ; untuk mengupas, menguliti; untuk mengeksploitasi"
"はさみ";"hasami";"gunting, pelubang kertas ; penjepit (kepiting, kalajengking, dll); cakar; tang ; engsel, gunting"
"柱";"hashira ; chuu ; ji ; juu";"pilar; pos, dukungan; menopang; andalan, counter bagi para buddha, dewa, bangsawan, dll. ; jembatan (dari koto, dll.), silinder; prisma ; resah (dari biwa)"
"橋渡し";"hashiwatashi";"pembangunan jembatan; mediasi; perantara; (melalui) jasa baik (seseorang)"
"恥";"haji";"malu; rasa malu; aib"
"弾く";"hajiku ; hiku";"membalik; Mengambil; untuk menjentikkan, menolak, menggunakan (sempoa); untuk menghitung, memetik; untuk memetik senar (gitar, dll.) ; untuk bermain (instrumen senar atau keyboard)"
"始め";"hajime";"awal; pembukaan, pertama (sejajar, dll.), asal, seperti...; apalagi..."
"始めまして";"hajimemashite";"Apa kabarmu?; Saya senang bertemu dengan Anda"
"恥じらう";"hajirau";"merasa malu; menjadi malu; memerah"
"恥じる";"hajiru";"merasa malu"
"はず";"hazu";"seharusnya); terikat (menjadi); diharapkan (menjadi); harus (menjadi), nock (dari busur), nock (dari anak panah), nock berbentuk pegangan (antara ibu jari dan telunjuk), bingkai kayu di ujung tiang kapal Jepang yang mencegah kapal tambang terjatuh ; membersihkan puring (Croton tiglium)"
"弾む";"hazumu";"ke musim semi; untuk mengikat; untuk memantul, untuk dirangsang; untuk didorong; untuk menjadi hidup, untuk membayar mahal; berbelanja secara royal; untuk berpisah dengan penuh semangat (uang, dll.), untuk bernapas dengan susah payah; terengah-engah; kehabisan nafas"
"破損";"hason";"kerusakan"
"果たして";"hatashite";"seperti yang diharapkan; seperti yang dipikirkan seseorang; tentu saja, sungguh; Sebenarnya; pernah"
"果たす";"hatasu";"untuk mencapai; untuk melaksanakan; untuk memenuhi; menyadari; untuk mengeksekusi; untuk melakukan; melakukan, melakukan... sepenuhnya; untuk melakukan... seluruhnya"
"働";"hatara.ku ; dou";"tenaga kerja; bekerja"
"裸足";"hadashi";"bertelanjang kaki, lebih unggul dari (seorang profesional, dll. dalam kemampuan atau prestasi)"
"蓮";"hachisu ; hasu";"teratai suci (Nelumbo nucifera); Teratai India, mawar Sharon (Hibiscus syriacus)"
"はちみつ";"hachimitsu";"Sayang"
"発掘";"hakkutsu";"penggalian, penemuan (misalnya bakat baru)"
"発生";"hassei";"wabah; meloncat maju; kejadian; insiden, pembangkitan (misalnya listrik atau panas); asal, ontogeni; pengembangan struktur multiseluler yang kompleks dari sel dalam keadaan sederhana"
"初";"hatsu ; ui ; ubu ; zome";"Pertama; baru ; tidak bersalah; naif; sederhana; tidak berpengalaman; hijau; basah di belakang telinga, lahir- ; perbuatan pertama... (pernah, dalam hidup seseorang, di tahun baru, dll.)"
"発";"hatsu";"keberangkatan; berangkat dari...); berangkat (pada waktu...), mengirim; dikirim oleh...); dikirim (di...), mesin, penghitung untuk tembakan, semburan gas, dll.; counter peluru, bom, dll; counter untuk pukulan (pukulan) ; ubin naga hijau, tangan pemenang dengan pung (atau kong) ubin naga hijau"
"発育";"hatsuiku";"pertumbuhan (fisik); perkembangan"
"発芽";"hatsuga";"pengecambahan; tumbuh; pemula"
"発言";"hatsugen";"penyataan; komentar; pengamatan; ucapan; pidato; usul"
"発病";"hatsubyou";"serangan (penyakit)"
"初耳";"hatsumimi";"sesuatu yang terdengar untuk pertama kalinya; mendengar sesuatu untuk pertama kalinya"
"果て";"hate";"tamat; ekstremitas; batasnya; batasannya; hasil"
"果てる";"hateru";"untuk mengakhiri; untuk diselesaikan; menjadi lelah, mati; binasa, melakukan sepenuhnya; untuk melakukan sepenuhnya"
"話し合い";"hanashiai";"diskusi; bicara; bertetangga; konferensi"
"甚だ";"hanahada";"sangat"
"はなばなしい";"hanabanashii";"cemerlang; bagus sekali; mulia; agung; spektakuler"
"花びら";"hanabira";"kelopak (bunga)."
"華やか";"hanayaka";"menyolok; cemerlang; sangat indah; jerau; homo"
"阻む";"habamu";"untuk mencegah seseorang melakukan; untuk berhenti; untuk mencegah; untuk memeriksa; untuk menghalangi; untuk melawan; untuk menggagalkan"
"浜";"hama";"pantai, potongan yang ditangkap (dalam permainan go); batu yang ditangkap, Yokohama, tepian sungai; tepi sungai"
"浜辺";"hamabe";"pantai; tepi pantai"
"はまる";"hamaru";"agar sesuai; untuk masuk ke; untuk dipasang (misalnya pintu dengan jendela), untuk digunakan (pekerjaan, dll.); cocok untuk; untuk memenuhi (kondisi), untuk jatuh ke dalam; untuk terjun ke; terjebak; tertangkap, tertipu; untuk dibawa masuk; jatuh ke dalam perangkap, menjadi kecanduan; untuk mendalami; menjadi tergila-gila; untuk terjebak"
"歯磨";"hamigaki";"menyikat gigi, pasta gigi; bubuk gigi"
"はめる";"hameru";"untuk memasukkan; untuk dimasukkan ke dalam (sehingga pas); untuk mengancingkan; untuk mengenakan (sesuatu yang menyelimuti, misalnya sarung tangan, cincin), untuk berhubungan seks; bercinta, ke dalam lubang merpati (ke dalam kategori tertentu), menempatkan benda berbentuk cincin di sekitar sesuatu (khususnya benda yang membatasi kebebasan, seperti borgol), menjebak; untuk menjebak seseorang (misalnya menjebak mereka atas kejahatan, dll.)"
"生やす";"hayasu";"untuk tumbuh; untuk mengolah; untuk memakai janggut"
"早める";"hayameru";"untuk memajukan (misalnya 3 jam); untuk memajukan; untuk mempercepat (misalnya kematian seseorang); untuk mempercepat, untuk mempercepat (misalnya langkah seseorang); untuk mempercepat"
"原";"hara ; gen ; bara";"bidang; polos; padang rumput; padang di kutub; tegalan; gurun ; asli; primitif; utama; mendasar; mentah ; diakhiri dengan kata-kata yang menunjukkan sekelompok orang untuk menciptakan bentuk jamak (khususnya dalam konteks tidak sopan)"
"腹立ち";"haradachi";"amarah"
"原っぱ";"harappa";"lapangan terbuka; Tanah kosong; polos"
"張り紙";"harigami";"tambalan kertas; dukungan kertas; poster; stiker; label"
"遥か";"haruka";"menjauh; jauh; di kejauhan, dahulu kala; jauh sebelum"
"破裂";"haretsu";"ledakan; pecah; memutuskan"
"はれる";"hareru";"membengkak (karena peradangan); menjadi bengkak ; untuk menjernihkan; untuk membersihkan; menjadi cerah; untuk menghentikan hujan, untuk menyegarkan (misalnya roh), untuk dibersihkan (misalnya dari kecurigaan), untuk dihilangkan; untuk dibuang"
"判";"han ; ban";"segel; stempel; tanda tangan monogram, penilaian, ukuran (kertas atau buku)"
"反";"han ; tan";"anti-, antitesis, fanqie; sistem ejaan tradisional Tiongkok yang menggunakan dua karakter: karakter pertama untuk permulaan, karakter kedua untuk rima dan nada ; ukuran kain yang bervariasi (lebar 28,8 cm); untuk kimono: panjangnya minimal 10 m; untuk haori: panjangnya minimal 7,27 m; untuk pakaian lainnya: panjang minimal 6,06 m, 300 tsubo (991,74 meter persegi, 0,24506 hektar), enam ken (10,91 m)"
"版";"han ; ban";"edisi; Versi: kapan; pencetakan; kesan; implementasi (misalnya perangkat lunak), pelat; memblokir; pemeran, edisi suatu terbitan"
"班";"han";"kelompok; berpesta; tim, skuad; bagian"
"繁栄";"han'ei";"kemakmuran; berkembang; maju"
"反感";"hankan";"antipati; antagonisme; kebencian; perubahan; perasaan sakit"
"版画";"hanga";"ukiran kayu; cetakan balok kayu; cetakan seni"
"反響";"hankyou";"gema, respon; reaksi; akibat; sensasi; pengaruh"
"判決";"hanketsu";"keputusan pengadilan; pertimbangan; kalimat; dekrit"
"反撃";"hangeki";"serangan balik; serangan balasan; pukulan balasan"
"反射";"hansha";"cerminan; gema, refleks"
"繁殖";"hanshoku";"pembiakan; perkalian; meningkatkan; perambatan; reproduksi"
"反する";"hansuru";"bertentangan dengan; menjadi tidak konsisten dengan; bertentangan, bertindak bertentangan dengan (aturan atau pedoman); melanggar; untuk melanggar, menentang; untuk memberontak"
"繁盛";"hansei ; hanjou";"kemakmuran; maju; berkembang"
"判定";"hantei";"pertimbangan; keputusan; pengadilan; menghadiahkan; dakwaan; tekad"
"反応";"hannou ; han'ou";"reaksi; tanggapan"
"半端";"hanpa";"sisa; pecahan; set tidak lengkap; ketidaklengkapan, pecahan; jumlah ganjil, setengah; setengah hati; asal-asalan, tidak bertanggung jawab; konyol"
"反発";"hanpatsu";"berlawanan; pemberontakan; memberontak; perlawanan; reaksi; penolakan, melambung; mundur; tolakan, reli (misalnya pada harga saham); pemulihan"
"反乱";"hanran";"pemberontakan; memberontak"
"はんらん";"hanran";"pemberontakan; memberontak ; meluap; banjir; penggenangan, kelebihan pasokan; kebanyakan"
"ばいきん";"baikin";"kuman; bakteri; cetakan, sesuatu yang berbahaya; hama"
"賠償";"baishou";"kompensasi; reparasi; ganti rugi"
"倍率";"bairitsu";"pembesaran; manfaat; amplifikasi; faktor skala, peringkat daya saing (misalnya untuk masuk universitas); rasio pelamar terhadap penerimaan"
"馬鹿馬鹿しい";"bakabakashii";"absurd; konyol; lucu; tidak masuk akal; bodoh"
"馬鹿らしい";"bakarashii";"absurd; konyol; bodoh; omong kosong; lucu; tidak masuk akal; menggelikan"
"漠然";"bakuzen";"tidak jelas; samar; kabur; ambigu"
"爆弾";"bakudan";"bom, alkohol dengan tambahan minuman keras (khususnya shōchū highball berbahan dasar anggur, juga bir dengan wiski)"
"爆破";"bakuha";"ledakan yang merusak; meledak; ledakan"
"暴露";"bakuro";"penyingkapan; paparan; wahyu"
"化ける";"bakeru ; fukeru";"untuk mengambil bentuk (khususnya mengacu pada roh, rubah, anjing rakun, dll.); untuk mengambil bentuk; untuk mengubah diri menjadi; mengubah diri menjadi, menyamarkan diri menjadi, berubah secara radikal; untuk bermetamorfosis, meningkat secara tak terduga dan dramatis (khususnya seorang aktor, artis, rikishi, dll.) ; menjadi tua; menjadi tua (khususnya dalam penampilan); untuk menunjukkan tanda-tanda usia"
"罰";"bachi ; batsu";"hukuman (ilahi); menyumpahi; retribusi ; hukuman; penalti"
"ばてる";"bateru";"menjadi lelah; menjadi usang"
"散蒔く";"baramaku";"untuk menyebar; untuk menyebarkan (misalnya rumor); untuk menyebar (misalnya kuman); untuk menyiarkan, untuk mendistribusikan secara luas (misalnya selebaran); untuk membagikan secara bebas; untuk menghabiskan secara sembarangan"
"万人";"bannin ; banjin ; mannin";"semua orang, sepuluh ribu orang"
"万能";"bannou ; mannou";"semua tujuan; kegunaan; universal, maha kuasa; mahakuasa; serba bisa (misalnya atlet)"
"番目";"banme ; tsugaime";"menunjukkan posisi dalam urutan, bagian pertunjukan kabuki ; persendian; engsel"
"費";"hi ; atae ; atai";"biaya; pengeluaran ; Atai (gelar turun temurun pasca-Taika yang sering diberikan kepada pengurus daerah)"
"灯";"hi ; akashi ; tou ; tomoshi ; toboshi ; tomoshibi ; akari";"lampu ; cahaya (khususnya sebagai persembahan keagamaan); lampu ; lampu; lamp, counter untuk lampu listrik ; lampu, mengumpan rusa dengan obor yang menyala ; lampu; obor ; lampu; penerangan; binar; kilau, lampu"
"否";"hi ; iie ; iiya ; ina";"TIDAK ; TIDAK, baiklah; eh; kenapa, sama-sama; sama sekali tidak; jangan sebutkan itu"
"非";"hi";"kesalahan, berjalan buruk; tidak menguntungkan; menjadi tidak menguntungkan, tidak-; non-; sebuah-"
"碑";"hi ; ishibumi";"tugu batu bertuliskan prasasti (khususnya peringatan generasi mendatang); prasasti"
"日当";"hiatari ; nittou";"paparan sinar matahari; tempat yang cerah, per hari ; tunjangan harian; upah harian"
"延いては";"hiiteha";"tidak hanya...tetapi juga; sebagai tambahan; akibatnya"
"控室";"hikaeshitsu";"ruang tunggu; ruang depan; ruang hijau"
"控える";"hikaeru";"untuk bersikap bersahaja; untuk menahan diri; untuk tidak melakukan; untuk menahan; untuk menahan diri dari..., membuat catatan yang berlebihan; untuk mencatat (misalnya nomor telepon), yang harus dipersiapkan; untuk menunggu, segera; untuk segera, berada dalam hubungan dekat (misalnya sebagai pendukung, dll.)"
"悲観";"hikan";"pesimisme; kekecewaan"
"東";"higashi ; himukashi ; hingashi ; ton ; azuma ; aduma";"timur ; ubin angin timur, tangan pemenang dengan pung (atau kong) ubin angin timur ; Jepang bagian timur (khususnya Kamakura atau Edo, dari sudut pandang Kyoto atau Nara); provinsi timur, timur, gerobak; yamatogoto; sitar asli Jepang senar enam, pasangan saya"
"匹";"hiki";"konter untuk hewan kecil, konter untuk gulungan kain (ukuran dua han), konter untuk kuda, konter gulungan kain"
"引き上げる";"hikiageru";"untuk menarik; untuk menyeret ke atas; untuk mengangkat, meningkatkan; untuk menaikkan (misalnya pajak), untuk menarik; untuk pergi; menarik; pensiun, untuk mempromosikan (seseorang ke posisi yang lebih tinggi), kembali ke rumah, untuk mempercepat jadwal"
"率いる";"hikiiru";"untuk memimpin; untuk menjadi ujung tombak (kelompok); untuk memerintah (pasukan)"
"引き受ける";"hikiukeru";"untuk mengambil; untuk melakukan; menerima; untuk mengambil alih; untuk memikul tanggung jawab untuk, mengambil alih; untuk mewarisi, untuk menjamin, tertular (suatu penyakit)"
"引き起こす";"hikiokosu";"menyebabkan; untuk menginduksi; untuk mewujudkan; untuk memprovokasi, untuk menarik tegak; untuk membantu (misalnya orang yang terjatuh)"
"引き下げる";"hikisageru";"untuk menarik ke bawah; untuk menurunkan; untuk mengurangi; untuk menarik"
"引きずる";"hikizuru";"untuk menyeret; menarik, memaksa seseorang, memperpanjang; untuk menarik, untuk mempengaruhi dengan kuat; untuk merayu"
"引き取る";"hikitoru";"untuk mengambil milik seseorang; menerima; untuk mengumpulkan; untuk mengklaim, untuk merawat seseorang (misalnya orang, hewan peliharaan); untuk mengambil hak asuh; untuk mengadopsi, pergi; untuk pergi; untuk menarik; untuk keluar"
"引き分け";"hikiwake";"seri (dalam kompetisi); permainan seri"
"否決";"hiketsu";"penolakan; penyangkalan; menolak"
"非行";"hikou";"kejahatan; pelanggaran"
"ひごろ";"higoro";"biasanya"
"久しい";"hisashii";"lama (waktu yang telah berlalu); cerita lama)"
"久し振り";"hisashiburi";"lama sekali (sejak terakhir kali); pertama setelah sekian lama"
"悲惨";"hisan";"bencana; tragis; menderita; malang; menyedihkan; sedih"
"秘書";"hisho";"(pribadi) sekretaris, buku berharga; buku rahasia"
"比重";"hijuu";"berat jenis; kepadatan relatif, kepentingan relatif; berat"
"密か";"hisoka";"rahasia; pribadi"
"浸す";"hitasu";"merendam; untuk mencelupkan; untuk curam; untuk merendam, untuk melembabkan; Untuk membasahi"
"左利き";"hidarikiki";"kekidalan; orang kidal, kesukaan terhadap alkohol; orang yang menyukai alkohol; peminum"
"ひっかく";"hikkaku";"stroke dalam karakter Cina ; untuk menggaruk; untuk mencakar"
"引っ掛ける";"hikkakeru";"untuk menggantung (sesuatu) pada (sesuatu); untuk melempar (pakaian), untuk mengait; untuk menangkap; untuk menjebak; untuk menjerat, menipu; untuk menghindari pembayaran; untuk melompati tagihan, untuk minum (alkohol), untuk memercikkan seseorang (dengan), untuk memukul bola dari ujung pemukul"
"必修";"hisshuu";"diperlukan (mata pelajaran)"
"匹敵";"hitteki";"untuk menjadi pasangan yang cocok; untuk menyaingi; untuk menyamakan; untuk membandingkan dengan; untuk menjadi setara dengan"
"必然";"hitsuzen";"tidak bisa dihindari; diperlukan; yakin; tentu, keniscayaan; kebutuhan"
"日付";"hiduke";"tanggal; penanggalan"
"一息";"hitoiki";"satu tarikan napas, waktu satu tarikan napas, jeda; merusak; istirahat; bernapas, (melakukan dalam) sekali jalan; melakukan tanpa henti, sedikit usaha; sedikit usaha lagi"
"人柄";"hitogara";"kepribadian; karakter; penampilan pribadi; keturunan ningrat"
"ひところ";"hitokoro";"sekali; beberapa waktu lalu"
"人質";"hitojichi";"sandera"
"一筋";"hitosuji";"satu benda lurus panjang (misalnya sehelai rambut, seberkas cahaya, segumpal asap), satu garis keturunan, sungguh-sungguh; tegas; maksud; setia; berpikiran tunggal, biasa; umum"
"一まず";"hitomazu";"untuk sekarang; untuk saat ini, meskipun belum cukup memuaskan; setelah mode"
"一目";"hitome ; ichimoku";"lirikan; Lihat; sekilas, tampilan lengkap; pemandangan dari atas ; Lihat; sekilas, batu (dalam permainan go)"
"一人でに";"hitorideni";"dengan sendirinya; secara otomatis; tentu saja"
"酷い";"hidoi ; mugoi";"kejam; keras; kasar; parah, kekerasan; intens; kuat; berat; ekstrim, sangat buruk; mengerikan, berlebihan; terlalu tinggi; keterlaluan; memalukan; tidak adil ; kejam; tanpa belas kasihan; brutal; mengerikan; tidak manusiawi, tragis; mengerikan; sangat buruk; menderita; jelek"
"日取り";"hidori";"tanggal tetap; hari yang ditentukan"
"雛";"hina ; hiyoko ; hiyokko";"burung muda; anak ayam; boneka hina yang masih muda; boneka yang ditampilkan selama Festival Anak Perempuan ; burung muda; anak ayam; pemula, pemula; anak burung yg baru bisa terbang; calon"
"日向";"hinata ; hyuuga";"tempat yang cerah; di bawah sinar matahari ; Hyūga (bekas provinsi yang terletak di Prefektur Miyazaki saat ini), Hyūga (kota)"
"非難";"hinan";"kritik; menyalahkan; mengecam; menyerang; mencela"
"避難";"hinan";"berlindung; menemukan tempat berlindung; pengungsian; melarikan diri; mencari tempat berlindung yang aman"
"日の丸";"hinomaru";"garis besar Matahari (khususnya direpresentasikan sebagai lingkaran merah), bendera Jepang"
"火花";"hibana";"percikan"
"ひび";"hibi";"retakan; celah, keretakan; split, bab; celah kulit ; setiap hari; sehari-hari; hari demi hari; hari (misalnya masa lalu yang indah) ; semak belukar, dll. digunakan sebagai budidaya untuk budidaya rumput laut atau tiram (culch)"
"暇";"hima ; itoma";"waktu luang; waktu senggang, waktu (misalnya waktu yang diperlukan untuk melakukan sesuatu), waktu istirahat; libur; liburan; hari libur; pergi, berhenti (pekerjaan seseorang); memecat seseorang; menceraikan (pasangan), (menjadi) tidak aktif; (urusan seseorang) lambat, pergi; berangkat"
"悲鳴";"himei";"menjerit; berteriak"
"百科事典";"hyakkajiten";"ensiklopedi"
"百科辞典";"hyakkajiten";"ensiklopedi"
"冷やかす";"hiyakasu";"untuk bercanda; untuk mengolok-olok; untuk mencemooh, mendinginkan; untuk mendinginkan, ke toko jendela; untuk melihat tanpa membeli"
"日焼け";"hiyake";"terbakar sinar matahari; warna coklat karena berjemur, berubah warna karena sinar matahari (misalnya kertas); menguning"
"票";"hyou";"Pilih; surat suara, label; tiket; menandai; rintisan"
"標語";"hyougo";"motto; slogan; kata semboyan"
"ひょっと";"hyotto";"mungkin, secara tidak sengaja"
"平たい";"hiratai";"datar; bahkan; tingkat; sederhana, polos (ucapan, dll.); sederhana"
"放り出す";"hiridasu ; houridasu";"untuk mengusir; untuk mengeluarkan; untuk mendorong keluar; untuk memaksa keluar ; untuk membuang, menjatuhkan; melempar; untuk membuang, meninggalkan; mengabaikan; untuk meninggalkan; menyerah, memberhentikan; ke tembak; untuk mengusir"
"比率";"hiritsu";"perbandingan; proporsi; persentase"
"肥料";"hiryou";"pupuk; kompos"
"昼間";"hiruma ; chuukan";"siang hari; pada siang hari; waktu dari matahari terbit hingga terbenam; periode diurnal"
"比例";"hirei";"proporsi, bagian representasi proporsional (pemilihan)"
"疲労";"hirou";"kelelahan"
"広まる";"hiromaru";"untuk menyebar; untuk disebarkan"
"貧困";"hinkon";"kemiskinan; membutuhkan; kemelaratan, kekurangan; ingin"
"品質";"hinshitsu";"kualitas (dari suatu produk atau layanan)"
"品種";"hinshu";"jenis (barang); merek, (taksonomi) bentuk, keturunan; kultivar"
"貧弱";"hinjaku";"miskin; kurus; lemah; hanya sedikit; lusuh; tdk kuat"
"頻繁";"hinpan";"sering; tak henti-hentinya"
"美";"bi ; mi";"kecantikan ; Agustus, cantik"
"微笑";"bishou";"senyum"
"美術";"bijutsu";"seni; seni rupa"
"びっくり";"bikkuri";"terkejut; menjadi kagum; menjadi takut; menjadi heran; untuk melompat, kejutan (misalnya pesta kejutan)"
"びっしょり";"bisshori";"basah kuyup; lepek"
"描写";"byousha";"penggambaran; keterangan; lukisan"
"びり";"biri";"terakhir (dalam daftar); (di dasar; (di) posisi terakhir; penarik"
"微量";"biryou";"jumlah yang sangat kecil; kuantitas yang sangat kecil"
"瓶";"bin ; hei ; kame";"botol; stoples; guci anggur; botol kecil ; toples atau vas dengan leher panjang dan sempit ; pot tembikar"
"敏感";"binkan";"peka; peringatan; menyadari; rentan"
"貧乏";"binbou";"dilanda kemiskinan; miskin; kikir"
"不意";"fui";"tiba-tiba; mendadak; tidak terduga; tak terduga"
"封";"fuu";"segel"
"封鎖";"fuusa";"blokade; kuncitara; menyegel (suatu area), pembekuan (dana)"
"風車";"fuusha ; kazaguruma";"kincir angin; turbin angin, kinwheel (mainan); kincir angin (mainan), Clematis patens (spesies tanaman merambat)"
"風習";"fuushuu";"kebiasaan"
"風俗";"fuuzoku";"tata krama; bea cukai, layanan seks; industri seks; hiburan berorientasi seks"
"風土";"fuudo";"fitur alami; topografi; iklim; ciri-ciri rohani"
"ふかけつ";"fukaketsu";"sangat diperlukan; penting"
"深める";"fukameru";"untuk memperdalam; untuk meningkatkan; untuk mengintensifkan"
"不吉";"fukitsu";"yg beralamat buruk; jahat; sial"
"不況";"fukyou";"depresi; resesi; kemerosotan"
"ふきん";"fukin";"lingkungan; sekitarnya; lingkungan sekitar; distrik, mendekat ; handuk teh; kain piring ; kapak"
"副";"fuku";"asisten; rekan; keburukan-; sub-; wakil; pengganti; bantu; tambahan; jaminan, rangkap; salin, kata keterangan"
"福";"fuku";"nasib baik; kebahagiaan; anugerah; semoga beruntung"
"複合";"fukugou";"gabungan; digabungkan; kompleks"
"福祉";"fukushi ; fukuchi";"kesejahteraan; kesejahteraan Sosial; keamanan sosial; Bakti sosial"
"覆面";"fukumen";"masker; kerudung; menyamar, anonim; tidak ditandai; penyamaran"
